{
  "approval": {
    "human_review": "required",
    "release_ready": false
  },
  "defaults": {
    "file": "_shared.json",
    "sha256": "1021b266770de941592e1d57a46ccf63185d511cba087648dd3c150766179a42"
  },
  "function_id": "OCF-SLP-002",
  "generation": {
    "binding_sha256": "7f8edb82a899b0385b7d401a715284442ceb13e325e7c92c29307eeb83593a47",
    "semantic_plan_sha256": "d63dba82435136432e94ec55ff18d40bac925cdc31f1ad9413b64bef7fdea40f"
  },
  "generator": "ocf.audio.plan/1",
  "locale": "en-US",
  "resources": [
    {
      "fallback": false,
      "key": "hplus.function.ocf-slp-002.closer",
      "locale": "en-US",
      "raw_template_sha256": "82792562c6b94193310108c3bef82bc3c08d09dec36a51b51a0e2284a00d3e49",
      "requested_locale": "en-US",
      "status": "reviewed",
      "text_sha256": "ef9c2624e22f72ce0e38238747fca833456fc82f29955e99ef022b37c920ba3e",
      "version": "1.2.1"
    },
    {
      "fallback": false,
      "key": "hplus.function.ocf-slp-002.function-body",
      "locale": "en-US",
      "raw_template_sha256": "f1b4556fc0c6aa76c289b3e55f4dc56cbe8ac9785b47ad6455330ed782e70e4a",
      "requested_locale": "en-US",
      "status": "reviewed",
      "text_sha256": "4a30cab667ad3cdf68ba3c3254e949f8e99495412fe1b0be3c2ff0854e09bd33",
      "version": "1.2.1"
    },
    {
      "fallback": false,
      "key": "hplus.function.ocf-slp-002.opener",
      "locale": "en-US",
      "requested_locale": "en-US",
      "status": "reviewed",
      "text_sha256": "94c646cd8d721d492e2167b76eca866e076a197c9588554f00739d456fdb84f7",
      "version": "1.2.0"
    }
  ],
  "schema_version": "1.0",
  "slots": {
    "closer": "hplus.function.ocf-slp-002.closer",
    "function_body": "hplus.function.ocf-slp-002.function-body",
    "opener": "hplus.function.ocf-slp-002.opener"
  },
  "timing": "measured-speech-relative; expand template at render time"
}
