{
  "approval": {
    "human_review": "required",
    "release_ready": false
  },
  "defaults": {
    "file": "_shared.json",
    "sha256": "11bbba20ac07012fbafa93e9d70fc420ec7408070455f42a49aab0d862f11229"
  },
  "function_id": "OCF-BOD-001",
  "generation": {
    "binding_sha256": "9dd01595fbbdd20409e7f4d4cf01af0e80a0a1dc5aba248156052fcaecf4a495",
    "semantic_plan_sha256": "930bbdea4e37545a190d683b5510928c8542590bb56316c3fd3d3e51399208bd"
  },
  "generator": "ocf.audio.plan/1",
  "locale": "en-US",
  "resources": [
    {
      "fallback": false,
      "key": "hplus.function.ocf-bod-001.closer",
      "locale": "en-US",
      "raw_template_sha256": "066798fb4306e7e5c0701e72945448231c91f2800ad879751b00bdd9ab347321",
      "requested_locale": "en-US",
      "status": "reviewed",
      "text_sha256": "041a2d1c21a8124692f9b5d16870215b5518d6914b97397778f7ee3812888952",
      "version": "1.3.1"
    },
    {
      "fallback": false,
      "key": "hplus.function.ocf-bod-001.function-body",
      "locale": "en-US",
      "raw_template_sha256": "0bffc9fe561ebe281b0f761df6488e1bf6fa7da4eead3281a4bd540056090618",
      "requested_locale": "en-US",
      "status": "reviewed",
      "text_sha256": "525ef208d4409c6c730057f25a44c15fc3a246e4c1626fced60d53801937902b",
      "version": "1.3.1"
    },
    {
      "fallback": false,
      "key": "hplus.function.ocf-bod-001.opener",
      "locale": "en-US",
      "requested_locale": "en-US",
      "status": "reviewed",
      "text_sha256": "408e4f0f37a35866d0ad047ce68585c7abc9c11e565b82b829b94ed6764d0c0e",
      "version": "1.3.0"
    }
  ],
  "schema_version": "1.0",
  "slots": {
    "closer": "hplus.function.ocf-bod-001.closer",
    "function_body": "hplus.function.ocf-bod-001.function-body",
    "opener": "hplus.function.ocf-bod-001.opener"
  },
  "timing": "measured-speech-relative; expand template at render time"
}
