{
  "approval": {
    "human_review": "required",
    "release_ready": false
  },
  "defaults": {
    "file": "_shared.json",
    "sha256": "11bbba20ac07012fbafa93e9d70fc420ec7408070455f42a49aab0d862f11229"
  },
  "function_id": "OCF-FND-001",
  "generation": {
    "binding_sha256": "210bfbe43b45c6568e6946eb11af2f9209fad8577c66194dc00a6cd6e0d53d59",
    "semantic_plan_sha256": "bfc84d2dce34abcd1b57019f6486fa22d0518d21dec107cfc5c902a39e59ffa7"
  },
  "generator": "ocf.audio.plan/1",
  "locale": "en-US",
  "resources": [
    {
      "fallback": false,
      "key": "hplus.function.ocf-fnd-001.closer",
      "locale": "en-US",
      "raw_template_sha256": "64e0f57c97895fbc6a20daeaf14341c07ffbac37ccbe33b4cdaa5eae20fd75ad",
      "requested_locale": "en-US",
      "status": "reviewed",
      "text_sha256": "fa3d5268b1920a9086efda34ade884338ca4b2722127f26fb37f1475ad06185c",
      "version": "1.2.0"
    },
    {
      "fallback": false,
      "key": "hplus.function.ocf-fnd-001.function-body",
      "locale": "en-US",
      "raw_template_sha256": "0d6e258d2ee875a4b6a1ae456a11d996a1fdafaedb01a0cecded258b23164f5e",
      "requested_locale": "en-US",
      "status": "reviewed",
      "text_sha256": "6f9ad693fa566a0c59d58da7fa711b00e8a2e0eb3ef57f8ca18a3780d32555d9",
      "version": "1.2.0"
    },
    {
      "fallback": false,
      "key": "hplus.function.ocf-fnd-001.opener",
      "locale": "en-US",
      "requested_locale": "en-US",
      "status": "reviewed",
      "text_sha256": "da446228637c225d9001229932ff29b7f7fa5baf5041363d7ff818865b4ed1fe",
      "version": "1.2.0"
    }
  ],
  "schema_version": "1.0",
  "slots": {
    "closer": "hplus.function.ocf-fnd-001.closer",
    "function_body": "hplus.function.ocf-fnd-001.function-body",
    "opener": "hplus.function.ocf-fnd-001.opener"
  },
  "timing": "measured-speech-relative; expand template at render time"
}
