{
  "approval": {
    "human_review": "required",
    "release_ready": false
  },
  "defaults": {
    "file": "_shared.json",
    "sha256": "fa013781ed94f4001b605eeeff507ffb5eeaa7d6e5e7bd816b009f212399f229"
  },
  "function_id": "OCF-PRF-005",
  "generation": {
    "binding_sha256": "0cfa6c717283e55789987de7e85e10e93fdd0280469a94db173ea1044925bfac",
    "semantic_plan_sha256": "50db953f7b153c8c97ac7cc5bcddff4b801cb7bfb7e013cdab224e85dd875060"
  },
  "generator": "ocf.audio.plan/1",
  "locale": "en-US",
  "resources": [
    {
      "fallback": false,
      "key": "hplus.function.ocf-prf-005.closer",
      "locale": "en-US",
      "raw_template_sha256": "8d4386b0d358da0f915550cd9243a7a23ddc758ea58691b7a5a454e0a3911ee4",
      "requested_locale": "en-US",
      "status": "reviewed",
      "text_sha256": "7360049eebd32a3009c31686071d9e52009980941794f991fc0a06e570d28486",
      "version": "1.2.0"
    },
    {
      "fallback": false,
      "key": "hplus.function.ocf-prf-005.function-body",
      "locale": "en-US",
      "raw_template_sha256": "876d98f486d4f26efad6586afbdb6fba34f0bed8f0077467405945bacddf666c",
      "requested_locale": "en-US",
      "status": "reviewed",
      "text_sha256": "fdffd3f224a846c7cb863d15881c0c4f5bb560723bbed1dddb8eb1c490f8b458",
      "version": "1.1.0"
    },
    {
      "fallback": false,
      "key": "hplus.function.ocf-prf-005.opener",
      "locale": "en-US",
      "requested_locale": "en-US",
      "status": "reviewed",
      "text_sha256": "957ab9653621b23be2ea43d6e2971f7604d43629d82b5602a56aaea3d4598338",
      "version": "1.1.0"
    }
  ],
  "schema_version": "1.0",
  "slots": {
    "closer": "hplus.function.ocf-prf-005.closer",
    "function_body": "hplus.function.ocf-prf-005.function-body",
    "opener": "hplus.function.ocf-prf-005.opener"
  },
  "timing": "measured-speech-relative; expand template at render time"
}
