{
  "approval": {
    "human_review": "required",
    "release_ready": false
  },
  "defaults": {
    "file": "_shared.json",
    "sha256": "8954559b2300d53c29f28ca3988f174296e5feb7ace0c29c0a5b0142161ec5ae"
  },
  "function_id": "OCF-BOD-004",
  "generation": {
    "binding_sha256": "a2a519e9147d70d00cc781deb2cde53a7df0db956fbd04fc3da2a67a488b1d79",
    "semantic_plan_sha256": "5390593c415350d42c0bdeb04d2782d249fecd6eda7b3a352f0208d8205ccbe8"
  },
  "generator": "ocf.audio.plan/1",
  "locale": "en-US",
  "resources": [
    {
      "fallback": false,
      "key": "hplus.function.ocf-bod-004.closer",
      "locale": "en-US",
      "raw_template_sha256": "c2f585eb518c0d661fa417efcb6d3a0916699b3bc75ec6320b52974b00ed2ecf",
      "requested_locale": "en-US",
      "status": "reviewed",
      "text_sha256": "b8123ec9832f3d00929ecb2e025346f8ec1b4a81a20626fcc4f3ce1b26b8f3df",
      "version": "1.2.1"
    },
    {
      "fallback": false,
      "key": "hplus.function.ocf-bod-004.function-body",
      "locale": "en-US",
      "raw_template_sha256": "6b49001a9fcfe3511f66198436a320b0e6cbdea40c5ed5a7933110b336404dd5",
      "requested_locale": "en-US",
      "status": "reviewed",
      "text_sha256": "fcac6e12d0d8a42b9a6cf1ea355220ea0aa1b94bcfd3122252d6013c676a96d8",
      "version": "1.2.1"
    },
    {
      "fallback": false,
      "key": "hplus.function.ocf-bod-004.opener",
      "locale": "en-US",
      "requested_locale": "en-US",
      "status": "reviewed",
      "text_sha256": "02119af31098a25eec92dea8a2da29cac22d3f488c53ebbf0599454332785f28",
      "version": "1.2.0"
    }
  ],
  "schema_version": "1.0",
  "slots": {
    "closer": "hplus.function.ocf-bod-004.closer",
    "function_body": "hplus.function.ocf-bod-004.function-body",
    "opener": "hplus.function.ocf-bod-004.opener"
  },
  "timing": "measured-speech-relative; expand template at render time"
}
