{
  "approval": {
    "human_review": "required",
    "release_ready": false
  },
  "defaults": {
    "file": "_shared.json",
    "sha256": "1976558ef50735e20e6875a0162d4ed111223c4b5681f19a186770daa07775d7"
  },
  "function_id": "OCF-PRF-002",
  "generation": {
    "binding_sha256": "4233067fde66524d5ac78154706e7f7739011c3f9099155aed3610228e6d7b16",
    "semantic_plan_sha256": "2042d265c78118d3946aac36f72176d06d8ece7675c88a6ab75b345735dc680b"
  },
  "generator": "ocf.audio.plan/1",
  "locale": "en-US",
  "resources": [
    {
      "fallback": false,
      "key": "hplus.function.ocf-prf-002.closer",
      "locale": "en-US",
      "raw_template_sha256": "79f9d8024013863d337269769619adea785655f35e80756481059ade43dfa5ef",
      "requested_locale": "en-US",
      "status": "reviewed",
      "text_sha256": "50ea2c64e0ed16ece928c5c15643bf9f2a4c04bfafe161dbfcadfb0a8e01b070",
      "version": "1.1.1"
    },
    {
      "fallback": false,
      "key": "hplus.function.ocf-prf-002.function-body",
      "locale": "en-US",
      "raw_template_sha256": "e667b7900ed46c1cb95b1a9c7eaa6ff92b48f531ee7133bb9df28a8a20180691",
      "requested_locale": "en-US",
      "status": "reviewed",
      "text_sha256": "9ddc7f135a7cc0e763bc356c6f1f05314452f2a414dbf1e246e03a4d627be407",
      "version": "1.1.1"
    },
    {
      "fallback": false,
      "key": "hplus.function.ocf-prf-002.opener",
      "locale": "en-US",
      "requested_locale": "en-US",
      "status": "reviewed",
      "text_sha256": "a96d274fdeea65b77d8ec2cdd933dbf17140c6d0550b00372ae38cbc95ae11cc",
      "version": "1.1.0"
    }
  ],
  "schema_version": "1.0",
  "slots": {
    "closer": "hplus.function.ocf-prf-002.closer",
    "function_body": "hplus.function.ocf-prf-002.function-body",
    "opener": "hplus.function.ocf-prf-002.opener"
  },
  "timing": "measured-speech-relative; expand template at render time"
}
