{
  "approval": {
    "human_review": "required",
    "release_ready": false
  },
  "defaults": {
    "file": "_shared.json",
    "sha256": "314034915c1d13bd2cbf564771c6e176b0c93169b25de1cee783eeee01a6db63"
  },
  "function_id": "OCF-SLP-001",
  "generation": {
    "binding_sha256": "75b8ef0b0ab90108575604679ba11857c6a31b8366f7d6bf4225056ca272c86f",
    "semantic_plan_sha256": "b647cde515db45b828100c66726171bfa7459e4c3e6264384dc3109a9244f966"
  },
  "generator": "ocf.audio.plan/1",
  "locale": "en-US",
  "resources": [
    {
      "fallback": false,
      "key": "hplus.function.ocf-slp-001.closer",
      "locale": "en-US",
      "requested_locale": "en-US",
      "status": "reviewed",
      "text_sha256": "3a29a9da4495aff76a52e1ddbaec91517b1caffb2988d0a8c51dfb6863b082c6",
      "version": "1.2.0"
    },
    {
      "fallback": false,
      "key": "hplus.function.ocf-slp-001.function-body",
      "locale": "en-US",
      "requested_locale": "en-US",
      "status": "reviewed",
      "text_sha256": "d1a75c9ab8e64dc0da74ef5e89e4d3ac1c0d9d8434030bee77aa11788c9e505c",
      "version": "1.2.0"
    },
    {
      "fallback": false,
      "key": "hplus.function.ocf-slp-001.opener",
      "locale": "en-US",
      "requested_locale": "en-US",
      "status": "reviewed",
      "text_sha256": "686bb1d0f0cc10c95e300cb60e4afd88f5e05eef8d1d6c993afda199d64ea9fe",
      "version": "1.2.0"
    }
  ],
  "schema_version": "1.0",
  "slots": {
    "closer": "hplus.function.ocf-slp-001.closer",
    "function_body": "hplus.function.ocf-slp-001.function-body",
    "opener": "hplus.function.ocf-slp-001.opener"
  },
  "timing": "measured-speech-relative; expand template at render time"
}
