{
  "approval": {
    "human_review": "required",
    "release_ready": false
  },
  "defaults": {
    "file": "_shared.json",
    "sha256": "8123ba9d82b37e482d785060720fd032ea03fa2cd635530472fa017589a4795d"
  },
  "function_id": "OCF-SEN-001",
  "generation": {
    "binding_sha256": "5ad8110f0303b7181045bdb09768a6c81e78a62150bbbf2341daec543db54d7e",
    "semantic_plan_sha256": "a6d0ac6b4e63e81b9248c745f229ba6cd34417416bc9c8293b711c03d7459bd2"
  },
  "generator": "ocf.audio.plan/1",
  "locale": "en-US",
  "resources": [
    {
      "fallback": false,
      "key": "hplus.function.ocf-sen-001.closer",
      "locale": "en-US",
      "raw_template_sha256": "3f7114bcfdbfa80e4157e7a88ef8bfd28e763ca1e21006f4a52fae2648f4e15b",
      "requested_locale": "en-US",
      "status": "reviewed",
      "text_sha256": "593ecefdbbf8dc4588b5dc60375ec5f1fadb05ba1023d2e4fe3decfa72ec24ee",
      "version": "1.2.1"
    },
    {
      "fallback": false,
      "key": "hplus.function.ocf-sen-001.function-body",
      "locale": "en-US",
      "raw_template_sha256": "63770ca2120550d9229c4a3aab6b7a4e019f262cbcb7758ebd7dd479caec67f9",
      "requested_locale": "en-US",
      "status": "reviewed",
      "text_sha256": "c92855642010421ce58dd9c6ff257f8c3c82159efdc3f2c6ec0e6ee4d7a01e46",
      "version": "1.3.0"
    },
    {
      "fallback": false,
      "key": "hplus.function.ocf-sen-001.opener",
      "locale": "en-US",
      "requested_locale": "en-US",
      "status": "reviewed",
      "text_sha256": "a21f395aaa94c2e25736c74696eadcbd709ebbc73fc3fb9555611e7fb7118027",
      "version": "1.2.0"
    }
  ],
  "schema_version": "1.0",
  "slots": {
    "closer": "hplus.function.ocf-sen-001.closer",
    "function_body": "hplus.function.ocf-sen-001.function-body",
    "opener": "hplus.function.ocf-sen-001.opener"
  },
  "timing": "measured-speech-relative; expand template at render time"
}
