{
  "approval": {
    "human_review": "required",
    "release_ready": false
  },
  "defaults": {
    "file": "_shared.json",
    "sha256": "cbe06d1f862a4e1e3fbb6f48e9c05b770c88fa9fc40e30a007a4c25f6d38f1f2"
  },
  "function_id": "OCF-COG-006",
  "generation": {
    "binding_sha256": "8856c66ccad3ac1bf624a340782cd3762786ce3674defb2aa39cc0404363b3a0",
    "semantic_plan_sha256": "8f6cd6536c518378e67c6c3b51da180b05e884703fe9cfa13bb76c21ab7ecfd1"
  },
  "generator": "ocf.audio.plan/1",
  "locale": "en-US",
  "resources": [
    {
      "fallback": false,
      "key": "hplus.function.ocf-cog-006.closer",
      "locale": "en-US",
      "requested_locale": "en-US",
      "status": "reviewed",
      "text_sha256": "ec3323a88fa29aaeb1d69fbae6e5aadc97818e282349f902b1a25ae08689348a",
      "version": "1.2.0"
    },
    {
      "fallback": false,
      "key": "hplus.function.ocf-cog-006.function-body",
      "locale": "en-US",
      "requested_locale": "en-US",
      "status": "reviewed",
      "text_sha256": "6d9947221013cfef0c541748a9c59cde2b4a3e78fa66daa7b24a3e3319b2cbc3",
      "version": "1.2.0"
    },
    {
      "fallback": false,
      "key": "hplus.function.ocf-cog-006.opener",
      "locale": "en-US",
      "requested_locale": "en-US",
      "status": "reviewed",
      "text_sha256": "f1c3c1cd56caee879bbd277f5bab2bb8a2b97896d0dec1f08377e3ac8f1238fa",
      "version": "1.2.0"
    }
  ],
  "schema_version": "1.0",
  "slots": {
    "closer": "hplus.function.ocf-cog-006.closer",
    "function_body": "hplus.function.ocf-cog-006.function-body",
    "opener": "hplus.function.ocf-cog-006.opener"
  },
  "timing": "measured-speech-relative; expand template at render time"
}
