{
  "approval": {
    "human_review": "required",
    "release_ready": false
  },
  "defaults": {
    "file": "_shared.json",
    "sha256": "11bbba20ac07012fbafa93e9d70fc420ec7408070455f42a49aab0d862f11229"
  },
  "function_id": "OCF-EXP-001",
  "generation": {
    "binding_sha256": "dd09511739c9a2148628da701c0cdc1f479a7efb5ef5dc2e47c7110683bb55ea",
    "semantic_plan_sha256": "a7facf79a97eb4e544fb8a2fdaf14f4ba8d26f885cba9977c58ff7b1adea76fe"
  },
  "generator": "ocf.audio.plan/1",
  "locale": "en-US",
  "resources": [
    {
      "fallback": false,
      "key": "hplus.function.ocf-exp-001.closer",
      "locale": "en-US",
      "raw_template_sha256": "c7385c89f1d7725e496960cc03d9107d759ea4e7941647b5197d6b62afdfa859",
      "requested_locale": "en-US",
      "status": "reviewed",
      "text_sha256": "88659b8cff9bb39e90eebe8ccff6b984668380e1fda11a774d2aa2bc42af7c7c",
      "version": "1.3.0"
    },
    {
      "fallback": false,
      "key": "hplus.function.ocf-exp-001.function-body",
      "locale": "en-US",
      "raw_template_sha256": "3c772abbda0aa143efeef7ea27470041b7581909ae48d630d916fb57b77de4c5",
      "requested_locale": "en-US",
      "status": "reviewed",
      "text_sha256": "ff908129faceac6740b5dc80057c95c6c9cb0635e265349ae12420180c06cd86",
      "version": "2.0.0"
    },
    {
      "fallback": false,
      "key": "hplus.function.ocf-exp-001.opener",
      "locale": "en-US",
      "requested_locale": "en-US",
      "status": "reviewed",
      "text_sha256": "5dd1bd0cc258c0d0f39d028667effe8a634e525abc9db11363748ea7345b1722",
      "version": "1.2.0"
    }
  ],
  "schema_version": "1.0",
  "slots": {
    "closer": "hplus.function.ocf-exp-001.closer",
    "function_body": "hplus.function.ocf-exp-001.function-body",
    "opener": "hplus.function.ocf-exp-001.opener"
  },
  "timing": "measured-speech-relative; expand template at render time"
}
