{
  "approval": {
    "human_review": "unknown",
    "release_ready": false
  },
  "defaults": {
    "file": "_shared.json",
    "sha256": "eb5bdc2823611d7e5412fdec47d524c12e6346c62c9c1e74f9293d30f28c7ac1"
  },
  "function_id": "OCF-EXP-003",
  "generation": {
    "binding_sha256": "df7a9d2f55b1e5aec9cb7d73188e0992ab1e9d94dbf69295b7ac6c0956fca054",
    "semantic_plan_sha256": "94b5c0abf7083fae7e867634c15d215942a3d832c6c0c1279d5b35e728c8e6f9"
  },
  "generator": "ocf.audio.plan/1",
  "locale": "en-US",
  "resources": [
    {
      "fallback": false,
      "key": "hplus.function.ocf-exp-003.closer",
      "locale": "en-US",
      "raw_template_sha256": "47d9e4b8c1897c6bdab80553436ca83e2940c4cc17832eb45d1cc318db3c2d75",
      "requested_locale": "en-US",
      "status": "reviewed",
      "text_sha256": "b9ff19524160322e0692e64b0f825881fc64dae9529f4721f48d9567a552f4fd",
      "version": "1.0.0"
    },
    {
      "fallback": false,
      "key": "hplus.function.ocf-exp-003.function-body",
      "locale": "en-US",
      "raw_template_sha256": "020a0b606c01e8fa7610949c68886d19b3377828975e3ca1807da038aac491b8",
      "requested_locale": "en-US",
      "status": "reviewed",
      "text_sha256": "1ccd21d6e9d4e3e8e6dad4975994ff0cd28ffb8ac69450f3668cd3b2a5e5b451",
      "version": "1.0.0"
    },
    {
      "fallback": false,
      "key": "hplus.function.ocf-exp-003.opener",
      "locale": "en-US",
      "requested_locale": "en-US",
      "status": "reviewed",
      "text_sha256": "39f21edbf745061de4f0deba2f001da071488bfdb4a300ea6523e49798048c06",
      "version": "1.0.0"
    }
  ],
  "schema_version": "1.0",
  "slots": {
    "closer": "hplus.function.ocf-exp-003.closer",
    "function_body": "hplus.function.ocf-exp-003.function-body",
    "opener": "hplus.function.ocf-exp-003.opener"
  },
  "timing": "measured-speech-relative; expand template at render time"
}
