{
  "approval": {
    "human_review": "required",
    "release_ready": false
  },
  "defaults": {
    "file": "_shared.json",
    "sha256": "868e9c01b241f45a26be4dc86e2ec60a89c90bf94a2c6a983da5f341eb01b9a4"
  },
  "function_id": "OCF-AUT-001",
  "generation": {
    "binding_sha256": "1572f59909efaace41293c181de746b2c36841513715c1f7f4ce7e7d1dc914bf",
    "semantic_plan_sha256": "a4bc7880527075743d3749887cd466b26dd1469ab7f387d96364ba3b4f76f2f2"
  },
  "generator": "ocf.audio.plan/1",
  "locale": "en-US",
  "resources": [
    {
      "fallback": false,
      "key": "hplus.function.ocf-aut-001.closer",
      "locale": "en-US",
      "requested_locale": "en-US",
      "status": "reviewed",
      "text_sha256": "d27acfb0e90accd949e3545da952742449e5fa432c0405ec0b34193332740672",
      "version": "1.2.0"
    },
    {
      "fallback": false,
      "key": "hplus.function.ocf-aut-001.function-body",
      "locale": "en-US",
      "requested_locale": "en-US",
      "status": "reviewed",
      "text_sha256": "dc014e4246a9815c41f55ca5b795acd3f94707ea85a6862d9c3fb2dc5a999862",
      "version": "1.1.0"
    },
    {
      "fallback": false,
      "key": "hplus.function.ocf-aut-001.opener",
      "locale": "en-US",
      "requested_locale": "en-US",
      "status": "reviewed",
      "text_sha256": "469880a565f2acfb6544334598353eed68b5c5cc87f54d37d71d8e3b4bf5d7a6",
      "version": "1.1.0"
    }
  ],
  "schema_version": "1.0",
  "slots": {
    "closer": "hplus.function.ocf-aut-001.closer",
    "function_body": "hplus.function.ocf-aut-001.function-body",
    "opener": "hplus.function.ocf-aut-001.opener"
  },
  "timing": "measured-speech-relative; expand template at render time"
}
