{
  "approval": {
    "human_review": "required",
    "release_ready": false
  },
  "defaults": {
    "file": "_shared.json",
    "sha256": "314034915c1d13bd2cbf564771c6e176b0c93169b25de1cee783eeee01a6db63"
  },
  "function_id": "OCF-COM-001",
  "generation": {
    "binding_sha256": "74150971dc17d63dcde24ab25007d6be9effd4edb05236ecfc44d28fcd6bde34",
    "semantic_plan_sha256": "e1f32002322273ab3b4eaf665cfabe04c2ae2297930a951a9eb41fd440774a86"
  },
  "generator": "ocf.audio.plan/1",
  "locale": "en-US",
  "resources": [
    {
      "fallback": false,
      "key": "hplus.function.ocf-com-001.closer",
      "locale": "en-US",
      "requested_locale": "en-US",
      "status": "reviewed",
      "text_sha256": "81b807e4a881da35db878f7c4574a0b589870e5962b94e0ad3e015f0710e2e8f",
      "version": "1.1.0"
    },
    {
      "fallback": false,
      "key": "hplus.function.ocf-com-001.function-body",
      "locale": "en-US",
      "requested_locale": "en-US",
      "status": "reviewed",
      "text_sha256": "9de4c0b7c25d62b21a76a57a92dc376b0e11a7b97962a678dda074544830a864",
      "version": "1.1.0"
    },
    {
      "fallback": false,
      "key": "hplus.function.ocf-com-001.opener",
      "locale": "en-US",
      "requested_locale": "en-US",
      "status": "reviewed",
      "text_sha256": "7b6048835d32e6813757b7bfeaf94155d8fcd60152f780acc1c253310f7545fb",
      "version": "1.1.0"
    }
  ],
  "schema_version": "1.0",
  "slots": {
    "closer": "hplus.function.ocf-com-001.closer",
    "function_body": "hplus.function.ocf-com-001.function-body",
    "opener": "hplus.function.ocf-com-001.opener"
  },
  "timing": "measured-speech-relative; expand template at render time"
}
