{
  "approval": {
    "human_review": "required",
    "release_ready": false
  },
  "defaults": {
    "file": "_shared.json",
    "sha256": "1021b266770de941592e1d57a46ccf63185d511cba087648dd3c150766179a42"
  },
  "function_id": "OCF-BOD-009",
  "generation": {
    "binding_sha256": "e71336c0a492e7594f5bd6d76ad18e0b57b89a4a9de78c620bf7f92b95560aad",
    "semantic_plan_sha256": "dc0e15f5260dbfe2c9dd69b4eeb12da71fd4ac46d79561f4bed031ba24617b79"
  },
  "generator": "ocf.audio.plan/1",
  "locale": "en-US",
  "resources": [
    {
      "fallback": false,
      "key": "hplus.function.ocf-bod-009.closer",
      "locale": "en-US",
      "raw_template_sha256": "d2454ebbe745c7a082b953da7b17931288d582e07923f8ec0a65f6cfb48b3d7a",
      "requested_locale": "en-US",
      "status": "reviewed",
      "text_sha256": "25f332161f349cc401b990a3797644bb003f60ed5f9951bee8ddb3431354635d",
      "version": "1.2.1"
    },
    {
      "fallback": false,
      "key": "hplus.function.ocf-bod-009.function-body",
      "locale": "en-US",
      "raw_template_sha256": "988dce0bea69aafb703f7eb066da316cfa216e339970e83fa8aaafb785f52d42",
      "requested_locale": "en-US",
      "status": "reviewed",
      "text_sha256": "3157edaf75e3268bf08e76343ac0cfc3b7617e7136c2a742f5dabd7dc63f1b85",
      "version": "1.2.0"
    },
    {
      "fallback": false,
      "key": "hplus.function.ocf-bod-009.opener",
      "locale": "en-US",
      "requested_locale": "en-US",
      "status": "reviewed",
      "text_sha256": "1005055b3eb53fdcb9722d1871b4a2425f35ad8fd3764cfeb3095e85d7547181",
      "version": "1.2.0"
    }
  ],
  "schema_version": "1.0",
  "slots": {
    "closer": "hplus.function.ocf-bod-009.closer",
    "function_body": "hplus.function.ocf-bod-009.function-body",
    "opener": "hplus.function.ocf-bod-009.opener"
  },
  "timing": "measured-speech-relative; expand template at render time"
}
