{
  "approval": {
    "human_review": "required",
    "release_ready": false
  },
  "defaults": {
    "file": "_shared.json",
    "sha256": "11bbba20ac07012fbafa93e9d70fc420ec7408070455f42a49aab0d862f11229"
  },
  "function_id": "OCF-PRF-001",
  "generation": {
    "binding_sha256": "805d2f213ed656afdc943e3f70647b6be5a0127d6ec8e30920c6830a61dac666",
    "semantic_plan_sha256": "e40959cb608c96eb6a96ece0dccc63d544ce6d9a54593be81a01b9d01f77ed1b"
  },
  "generator": "ocf.audio.plan/1",
  "locale": "en-US",
  "resources": [
    {
      "fallback": false,
      "key": "hplus.function.ocf-prf-001.closer",
      "locale": "en-US",
      "raw_template_sha256": "e39dcef96c366c73745e9d285603dc7c91253fd43a20f5eb5f2e6c5023143004",
      "requested_locale": "en-US",
      "status": "reviewed",
      "text_sha256": "de44b8c7bc18275051bc6c20ae869b029ef8c9279d1bb99d51bf1150e7669580",
      "version": "1.2.0"
    },
    {
      "fallback": false,
      "key": "hplus.function.ocf-prf-001.function-body",
      "locale": "en-US",
      "raw_template_sha256": "04827f2cd7bc2874af15571f246867d5f45d3ae137a445dda1b66eebfa0feb41",
      "requested_locale": "en-US",
      "status": "reviewed",
      "text_sha256": "8a2f5220528b380e52564eadc6f8441b20eb75621c764a5312a79622e88e497d",
      "version": "1.2.0"
    },
    {
      "fallback": false,
      "key": "hplus.function.ocf-prf-001.opener",
      "locale": "en-US",
      "requested_locale": "en-US",
      "status": "reviewed",
      "text_sha256": "e139a386aaa5f2ae513da491444dfc75220b52d8d4af2e94c0d207fda8d72787",
      "version": "1.2.0"
    }
  ],
  "schema_version": "1.0",
  "slots": {
    "closer": "hplus.function.ocf-prf-001.closer",
    "function_body": "hplus.function.ocf-prf-001.function-body",
    "opener": "hplus.function.ocf-prf-001.opener"
  },
  "timing": "measured-speech-relative; expand template at render time"
}
