{
  "approval": {
    "human_review": "required",
    "release_ready": false
  },
  "defaults": {
    "file": "_shared.json",
    "sha256": "1976558ef50735e20e6875a0162d4ed111223c4b5681f19a186770daa07775d7"
  },
  "function_id": "OCF-BOD-008",
  "generation": {
    "binding_sha256": "2f6fffdc10985089a90821f671477325e805a2c4e5055f4e6898ae4031c10683",
    "semantic_plan_sha256": "6c1dc2c2a78a23fb543b1335344e43aaba918c787c50d8ec7d42826c51db7201"
  },
  "generator": "ocf.audio.plan/1",
  "locale": "en-US",
  "resources": [
    {
      "fallback": false,
      "key": "hplus.function.ocf-bod-008.closer",
      "locale": "en-US",
      "raw_template_sha256": "ddc7a95dd771ec8dddb91925ff9a61864af53cb728d2d1b1643413589fcce1b3",
      "requested_locale": "en-US",
      "status": "reviewed",
      "text_sha256": "c4cddd6226f99f9b74ea2f78e852cc1cd6786b4ac5738a68b61e09c19a7109fd",
      "version": "1.2.1"
    },
    {
      "fallback": false,
      "key": "hplus.function.ocf-bod-008.function-body",
      "locale": "en-US",
      "raw_template_sha256": "eae6db70151eb82b8e532979ce49a4fb66a81e30751301a0d18a8b726e388264",
      "requested_locale": "en-US",
      "status": "reviewed",
      "text_sha256": "6f857fb22bea3d0e54e0217471828090813db25fe5b5fdbfddb8c4de77ae4fe2",
      "version": "1.2.1"
    },
    {
      "fallback": false,
      "key": "hplus.function.ocf-bod-008.opener",
      "locale": "en-US",
      "requested_locale": "en-US",
      "status": "reviewed",
      "text_sha256": "60460e3d8ef56b697de1d32676a27f11ce1dcfbbef8bcd473f2904784a497209",
      "version": "1.2.0"
    }
  ],
  "schema_version": "1.0",
  "slots": {
    "closer": "hplus.function.ocf-bod-008.closer",
    "function_body": "hplus.function.ocf-bod-008.function-body",
    "opener": "hplus.function.ocf-bod-008.opener"
  },
  "timing": "measured-speech-relative; expand template at render time"
}
